{
  "$schema": "../../docs/schemas/external-material-effect-v1.schema.json",
  "apiVersion": 1,
  "kind": "mmd-material",
  "name": "Aurora Opal",
  "description": "テクスチャ不要。流れる鉱石模様、虹色の干渉色、発光する細い帯とリムを重ねた装飾材質。",
  "sources": ["main.wgsl"],
  "hooks": { "finalColor": "shadeOpal" },
  "inputs": {
    "Time": { "type": "f32", "semantic": "TIME", "annotations": { "SyncInEditMode": true } },
    "WorldInverse": { "type": "mat4x4f", "semantic": "WORLDINVERSE", "annotations": { "Object": "Geometry" } },
    "CameraPosition": { "type": "vec3f", "semantic": "POSITION", "annotations": { "Object": "Camera" } },
    "LightDirection": { "type": "vec3f", "semantic": "DIRECTION", "annotations": { "Object": "Light" } }
  },
  "parameters": {
    "BodyColor": { "type": "vec3f", "default": [0.025, 0.065, 0.16], "ui": { "label": "鉱石の地色", "control": "color", "min": 0, "max": 1 } },
    "RimColor": { "type": "vec3f", "default": [0.25, 0.95, 0.85], "ui": { "label": "発光色", "control": "color", "min": 0, "max": 1 } },
    "PatternScale": { "type": "f32", "default": 0.65, "ui": { "label": "模様の細かさ", "min": 0.02, "max": 8, "step": 0.02 } },
    "Speed": { "type": "f32", "default": 0.35, "ui": { "label": "流れる速さ", "min": -2, "max": 2, "step": 0.05 } },
    "RibbonWidth": { "type": "f32", "default": 0.075, "ui": { "label": "光の帯の太さ", "min": 0.01, "max": 0.3, "step": 0.005 } },
    "Glow": { "type": "f32", "default": 0.7, "ui": { "label": "発光の強さ", "min": 0, "max": 2, "step": 0.05 } },
    "Coating": { "type": "f32", "default": 0.92, "ui": { "label": "コーティングの強さ", "min": 0, "max": 1, "step": 0.01 } }
  }
}
