{
  "$schema": "../../docs/schemas/external-material-effect-v1.schema.json",
  "apiVersion": 1,
  "kind": "mmd-material",
  "name": "Prismatic Fire",
  "description": "白い光沢の中に、角度が合うと赤・緑・青の細いきらめきが現れる。背景屈折なしの見た目優先サンプル。",
  "sources": ["main.wgsl"],
  "hooks": { "finalColor": "shadePrismaticFire" },
  "inputs": {
    "WorldInverse": { "type": "mat4x4f", "semantic": "WORLDINVERSE", "annotations": { "Object": "Geometry" } },
    "CameraPosition": { "type": "vec3f", "semantic": "POSITION", "annotations": { "Object": "Camera" } },
    "LightDirection": { "type": "vec3f", "semantic": "DIRECTION", "annotations": { "Object": "Light" } }
  },
  "parameters": {
    "BodyColor": { "type": "vec3f", "default": [0.3, 0.32, 0.35], "ui": { "label": "石の地色", "control": "color", "min": 0, "max": 1 } },
    "FacetScale": { "type": "f32", "default": 4.5, "ui": { "label": "きらめきの細かさ", "min": 0.1, "max": 16, "step": 0.1 } },
    "FireSpread": { "type": "f32", "default": 0.17, "ui": { "label": "色の分かれ幅", "min": 0, "max": 0.4, "step": 0.01 } },
    "Sharpness": { "type": "f32", "default": 96, "ui": { "label": "きらめきの鋭さ", "min": 8, "max": 256, "step": 4 } },
    "FireStrength": { "type": "f32", "default": 2, "ui": { "label": "色のきらめきの強さ", "min": 0, "max": 4, "step": 0.1 } },
    "Coating": { "type": "f32", "default": 1, "ui": { "label": "コーティングの強さ", "min": 0, "max": 1, "step": 0.01 } }
  }
}
