{
  "$schema": "../../docs/schemas/external-material-effect-v1.schema.json",
  "apiVersion": 1,
  "kind": "mmd-material",
  "name": "MME Inputs / 材質・ライト・視点",
  "description": "同じDIFFUSEでもObjectで材質色とライト色を区別。材質の光沢値と視点から簡易照明を組み立てる教材。",
  "sources": ["main.wgsl"],
  "hooks": { "finalColor": "shadeMmeLighting" },
  "inputs": {
    "MaterialDiffuse": { "type": "vec4f", "semantic": "DIFFUSE", "annotations": { "Object": "Geometry" } },
    "MaterialAmbient": { "type": "vec3f", "semantic": "AMBIENT", "annotations": { "Object": "Geometry" } },
    "MaterialSpecular": { "type": "vec3f", "semantic": "SPECULAR", "annotations": { "Object": "Geometry" } },
    "MaterialSpecularPower": { "type": "f32", "semantic": "SPECULARPOWER", "annotations": { "Object": "Geometry" } },
    "LightDiffuse": { "type": "vec3f", "semantic": "DIFFUSE", "annotations": { "Object": "Light" } },
    "LightDirection": { "type": "vec3f", "semantic": "DIRECTION", "annotations": { "Object": "Light" } },
    "CameraPosition": { "type": "vec3f", "semantic": "POSITION", "annotations": { "Object": "Camera" } }
  },
  "parameters": {
    "DisplayMode": { "type": "u32", "default": 0, "ui": { "label": "表示 0:照明 1:材質色 2:ライト色 3:光沢 4:リム", "min": 0, "max": 4, "step": 1 } },
    "RimStrength": { "type": "f32", "default": 0.35, "ui": { "label": "視点依存リムの強さ", "min": 0, "max": 2, "step": 0.05 } },
    "Blend": { "type": "f32", "default": 1, "ui": { "label": "教材表示の強さ（0で元の材質）", "min": 0, "max": 1, "step": 0.01 } }
  }
}
