{
  "$schema": "../../docs/schemas/external-material-effect-v1.schema.json",
  "apiVersion": 1,
  "kind": "mmd-material",
  "name": "MME Space Grid",
  "description": "WORLDINVERSEでモデル側の座標へ戻し、WORLDVIEWPROJECTIONで画面へ投影。物体に付く格子と画面に付く格子を比較。",
  "sources": ["main.wgsl"],
  "hooks": { "finalColor": "shadeMmeGrid" },
  "inputs": {
    "World": { "type": "mat4x4f", "semantic": "WORLD", "annotations": { "Object": "Geometry" } },
    "WorldInverse": { "type": "mat4x4f", "semantic": "WORLDINVERSE", "annotations": { "Object": "Geometry" } },
    "WorldViewProjection": { "type": "mat4x4f", "semantic": "WORLDVIEWPROJECTION", "annotations": { "Object": "Geometry" } },
    "ViewportSize": { "type": "vec2f", "semantic": "VIEWPORTPIXELSIZE" }
  },
  "parameters": {
    "DisplayMode": { "type": "u32", "default": 2, "ui": { "label": "格子 0:物体座標 1:画面座標 2:左右比較", "min": 0, "max": 2, "step": 1 } },
    "ObjectSpacing": { "type": "f32", "default": 0.35, "ui": { "label": "物体格子の間隔（MMD単位）", "min": 0.01, "max": 20, "step": 0.05 } },
    "PixelSpacing": { "type": "f32", "default": 32, "ui": { "label": "画面格子の間隔（pixel）", "min": 8, "max": 256, "step": 4 } },
    "LineWidth": { "type": "f32", "default": 1.5, "ui": { "label": "線幅（描画pixel）", "min": 0.5, "max": 8, "step": 0.5 } },
    "Strength": { "type": "f32", "default": 0.85, "ui": { "label": "格子の強さ", "min": 0, "max": 1, "step": 0.05 } }
  }
}
