{
  "$schema": "../../schemas/external-material-effect-v1.schema.json",
  "apiVersion": 1,
  "kind": "mmd-material",
  "name": "タイムライン連動の色調整",
  "sources": ["main.wgsl"],
  "hooks": {
    "surface": "shadeSurface",
    "finalColor": "shadeFinalColor"
  },
  "inputs": {
    "Time": {
      "type": "f32",
      "semantic": "TIME",
      "annotations": { "SyncInEditMode": true }
    }
  },
  "parameters": {
    "Tint": {
      "type": "vec3f",
      "default": [1.0, 0.85, 0.95],
      "ui": { "label": "色", "control": "color", "min": 0, "max": 1 }
    },
    "Strength": {
      "type": "f32",
      "default": 0.25,
      "ui": { "label": "強さ", "control": "number", "min": 0, "max": 1, "step": 0.01 }
    }
  }
}
